성당 태왕아너스 메트로'는 분양시장이 초역세권 입지와 변화하는 라이프스타일에 맞춘 혁신평면으로 아파트 선택에 미치는 영향력이 커지고 있는 가운데, 분양관계자는 합리적인 분양가와 중도금무이자 등의 분양조건에 실수요자들이 높은 청약경쟁률을 기대한다고 밝혔다.	태왕의 '성당 태왕아너스 메트로'모델하우스는 초역세권 입지와 변화하는 라이프스타일에 맞춘 혁신평면으로 오픈 당일부터 관람객의 줄이 이어지면서 관람객의 호평을 받았다.
최근 늘어나고 있는 집회시위에서 가장 문제가 되는 것은 바로 '소음'이며 이러한 소음으로 인한 일상생활에 대한 고통을 해결하기 위해서는 법률적으로 미비한 점이 많다.	최근 늘어나고 있는 집회시위에서 소음이 문제가 되고 있는데 현행 집회와 시위에 관한 법률에서는 소음을 규제하고 있으나 그 기준이 일반 시민이 느끼는 기준과 괴리감이 심해 집회인들은 자신들의  요구를 전달하기 위해 확성기 사용은 불가피하다고 주장하고 있고 대다수 주민들은 소음으로 인해 많은 불편함을 느끼고 있다.
고흥군은 도시민 유치와 귀농·귀촌인의 안정적인 정착을 위해 지난 19일 옛 망주초등학교에서 송귀근 군수, 송우섭 군의회 의장, 귀농·귀촌인, 주민 등 300여명이 참석한 가운데 고흥 귀농귀촌행복학교 개교 행사를 가졌다.	지난 19일 고흥군에 따르면 송귀근 군수와 주민 등 300여 명이 참석한 가운데 귀농·귀촌인의 안정적인 정착을 돕고 영농교육 등을 담당하기 위해 지난해부터 추진했던 ‘귀농귀촌 행복학교'의 개교 행사를 했다.
23일 조선대학교 하이다이빙 경기장에서 열린 여자 하이다이빙 최종전에서 호주의 이프랜드가 금메달을 차지해 대회 2연패를 달성했다.	23일 조선대학교에서 열린 여자 하이다이빙 최종전에서 호주의 이프랜드가 금메달을 차지해 여자 하이다이빙 최강자임을 다시 한번 입증했다.
인사혁신처는 2019년도 시간선택제 국가공무원 경력경쟁 채용시험 시행계획을 3일 사이버국가고시센터에서 발표했다.	사이버 국가고시센터에서는 시간선택제 공무원을 선발 하는데, 시간선택제 공무원은 통상적인 근무시간보다 짧게 근무하는 공무원을 말하며, 정년은 60세로 동일하고 승진소요 최저연수,보수는 근무시간과 비례해 인정.지급한다.
홍성군 오관지구 내 공동주택 건설 사업이 본격화 되면서, 민간사업자 공모는 3개월간 진행되고, 이후 지자체 인허가 및 설계를 걸쳐 빠르면 올 하반기 말이나 2021년 3월 본격적인 보상절차가 이루어질 예정이다.	한국토지주택공사는 지난 7일 홍성오관지구의 민간사업자 공모를 공고하고 사업자 선정에 착수하였으며 군 역세권내 공동 주택 건설을 비롯하여 원도심 지역의 개발이 가시화되고 있다.
국토부는 미계약분 물량이 일부 현금 부자들에게 돌아가는 일명 '줍줍현상'을 방지하기 위해 청약시스템(아파트투유) 개선이 필요한 사항으로 이달 20일부터 예비당첨자 비율을 5배수로 확대한다고 밝혔다.	국토교통부는 당첨자 및 예비당첨자 모두 계약을 포기하거나 부적격 취소될 시 남은 물량을 무순위 청약으로 공급하였는데 최근 무순위 청약물량이 과도하게 발생하면서 일부에서 현금부자들이 아파트분양을 많이 받게되는 현상이 벌어져 이를 막기 위해 예비 당첨자 비율 확대 등을 통해 무순위 청약을 개선할 계획이라고 9일 밝혔다.
최근 경영애로를 겪고 있는 소상공인과 자영업자의 금융비용 부담을 완화하고 서민경제의 활력을 제고하기 위해 기업은행, 기술보증기금,신용보증재단 중앙회·기업은행이 31일 서울 중구 기업은행 본점에서 '소상공인·자영업자 특별 금융지원 업무협약'을 체결했다.	신용보증기금 등 3개 기관은 31일 서울 중구 기업은행 본점에서 최근 경영에 어려움을 겪는 소상공인 등의 금융비용 부담을 줄이고 서민경제에 활력을 주기 위해 '소상공인. 자영업자 특별 금융지원 업무협약'을 체결했다고 전했으며 지원대상은 필요한 조건을 갖춘 수출중소기업, 유망창업기업 등이다.
광주 지방 국세청은 17일 정부광주지방합동청사 3층 세미나실에서 혁신성장 기업 대표 50여명을 대상으로 다양한 세정지원 제도를 안내하는 동시에 기업 현장의 애로·건의사항을 경청하기 위해 ‘상생하고 포용하는 세정구현을 위한’ 혁신성장 기업 세정지원 설명회를 열어 주목을 끌었다.	광주지방국세청은 '상생하고 포용하는 세정구현을 위한' 혁신성장 기업 세정지원 설명회를 열어 여러 세정지원 제도를 안내하고 기업 현장의 애로, 건의사항을 경청하며 기업 맞춤형 세정서비스를 제공할 것을 약속했다.
전국협동조합 노동조합 경기·인천지역본부 노조원들은 30일 강화읍 강화 옹진 축산업협동조합 본점 앞에서 조합 자체감사와 2번에 걸친 농협중앙회 감사, 검찰의 수사과정에서 조합장이 임의 채용한 서울축산물유통센터(센터)장 A씨에게 부당한 자금 지원을 하는 등 비상식적인 약정으로 막대한 재산상 손실을 끼쳐온 축협장의 즉각적인 퇴진을 촉구했다.	전국협동조합 노조원들이 비상식적인 약정으로 막대한 재산상 손실을 끼치고 적자결산을 하는 등 부실·방만 경영을 한 조합장의 즉각적인 퇴진을 촉구했다.
인천시 연수구는 송도동 9천427m2 규모의 부지에 도서관을 건립하기 위해 총 사업비 393억100만 원 중 토지매입비 90억 원과 용역비 등을 포함하여 117억 원을 지출했고, 4월에는 송도5동에 청소년수련관, 송도5동 행정복지센터, 거점형 공공직장어린이집을 건립하기 위해 6천9m2를 인천경제자유구역청으로부터 54억4천171만 원을 들여 매입하였다.	인천시 연수구가 주민시설 건립을 연이어 추진하여, 일각에서 재정부담에 우려를 보였다.
MBC '뉴스데스크'에 따르면 지난해 7월 7일 새벽 5시 1분, 한 남성이 몸부림을 치며 동공이 크게 확대돼 있다는 내용의 119 신고 전화가 걸려왔다고 전했다.	손님 폭행 논란을 시작으로 성폭행과 마약 의혹을 받고 있는 클럽 버닝썬에 대한 VIP 고객의 증언이 확보돼 의혹이 커지고 있다.
22일 기획재정부는 경남 창원·거제·통영·고성, 울산 동구, 전북 군산, 전남 목포·영암·해남 등 고용·산업 위기 지역의 설 경기를 활성화하기 위해 '비상금' 성격의 일반 예비비와 특별 교부세를 900억 원 규모로 지원한다고 밝혔다.	22일 국무회의에서 기획재정부가 발표한 '설 민생안정 대책'의 내용에 따르면, 정부는 설 경기를 활성화하기 위해 고용·산업 위기 지역에 일반 예비비 900억 원을 지원하며, 자금난을 겪는 중소기업과 소상공인에게 33조 원을 지원한다. 
6일 송 송갑석 의원은 안중근의사 기념관, 백범 김구 기념관 등이 전범기업과 특수관계에 있는 에스원과 보안서비스 계약을 맺고 있어 부적절하다는 지적을 받고 있다고 밝혔다.	전범기업과 특수관계에 있는 보안업체 '에스원'이 항일 독립운동의 상징인 안중근 의사 기념관, 백범 김구 기념관, 독도 의용수비대 기념관을 지키는 것이 과연 적절한지에 대한 의문이 나오고 있다.
광양시는 평화의 소녀상이 건립될 광양역사문화관 앞 건립모금도 당초 목표액과 달성 시기를 앞당기며 2월 2일 현재 9000만원을 넘기고 건립모금도 당초 목표액과 달성 시기를 앞당기며 3월 1일에 광양역사문화관 앞 건립을 확정한다.	광양 평화의 소녀상'은 시민여론조사를 통해 선택된 최종 장소 3곳 중 역사성과 접근성이 가장 좋은 광양역사문화관에 건립되기로 했다. 
인천시는 2019년 새해를 맞아 교육문화, 복지, 여성과 노인, 일자리, 환경 등에 대한 올해 청사진을 제시하며 시민에게 직접 혜택을 줄 수 있는 교육과 문화, 복지 등 분야에 대한 지원책을 확대한다.	인천시는 1일 2019년 부터 달라지는 지원 정책을 소개하는 책 ‘2019년 인천시민의 생활은 어떻게 달라질까요’을 발간했다.
김무일 선생 김무일 선생은 1927년 12월 10일경 태인동에서 조선어로 된 문서에 일제의 불법 감금 폐지와 조선어 사용 확립 조선어 교사 등용 등의 내용을 담은 문서를 광양 일대에 배포한 혐의로 일본경찰에 체포돼 소위 출판법 위반으로 금고 6개월에 집행유예 3년형을 받았다.	김태수, 최영근, 최한원, 김무일, 최백근 등은 일제에 맞서 하동 독립운동을 주도한 주요 광양 독립운동가들이다. 
안산시는 아프리카돼지열병(ASF) 확산 방지를 위해 28일 예정된 제34회 시민의 날 기념 체육대회의 공식일정을 취소하고 연기하기로 결정했다.	안산시는 경기북부지역과 인천 강화군을 중심으로 확진 사례가 잇따르고 있는 아프리카돼지열병확산 방지를 위해 28일 와~스타디움에 7천700여명이 참여할 예정이었던 제34회 시민의 날 기념 체육대회의 공식일정을 취소하기로 했다.
한국농수산식품유통공사(aT, 사장 이병호) 화훼사업센터는 여름철을 맞아 실내온도 조절, 공기정화, 벌레퇴치에 좋은 '기능성 반려식물 3총사'를 추천했는데, 이 식물은 암모니아, 일산화탄소, 포름알데히드 등 실내 오염물질을 흙 속 미생물의 영양원으로 활용해 공기를 정화해준다.	30일 한국 농수산식품유통공사 화훼사업센터는 본격적인 여름철을 맞아 공기정화, 벌레퇴치에 좋은 ‘기능성 반려식물 3총사’를 추천하며 식물은 증산작용을 하는데 이때 주변의 열을 흡수하게 되고 미세먼지에는 공기정화 식물이 도움이 된다고 말했다.
지난 13일 향아식당에서 열린 (사)한국예술문화단체총연합회 당진지회 정기총회에서 임세광 시인이 임기를 마칠 수 있도록 따뜻한 마음을 보여주고 격려해준 당진 예술인들에게 감사드린다고 전했다.	(사)한국예술문화단체총연합회 당진지회는 13일 제13차 종기총회를 열고 임세광 시인을 제5대 지회장으로 선출하고 2017년 결산 및 2018년도 사업계획(안)을 승인했으며, 임세광 신임지회장은 당진예총 발전에 힘쓰겠다고 말하였다.
경북지역에 큰 피해를 입은 영덕 재난상황실을 방문하여 피해 복구 상황과 안전대책 및 복원계획을 점검하는 등 지역민들에게 조속한 피해 복구와 지원대책 마련을 약속했다.	태풍 '미탁'으로 경북지역에 큰 피해가 발생하면서 자유한국당 의원들은 지난 4일부터 피해 사후 수숩을 위해 연일 현장행보를 보였고, 더불어민주당 경북도당도 재해지역을 돕기 위해 당력을 집중하는 등 민생행보에 집중했다.
광주시는 주요 핵심사업에 대한 과감하고 본격적인 예산투자를 통해 2020년을 '광주 도약의 해'로 만들어 갈 계획이다.	광주시가 광주형 일자리 만들기와 인공지능 중심도시 조성 등 주요 핵심사업에 대한 전폭적인 투자 유치로 2020년을 광주 도약의 해로 만들어 갈 것이라고 밝혔다.
경기도내 유권자 3분의 1을 차지하는 ‘20·30세대’를 대변할 청년층의 여의도 정치 입성은 여전히 난기류 양상이며, 중앙선거관리위원회의 내년 4·15 총선 지역구 출마 예비후보자 현황을 보면, 이날까지 등록된 도내 30세 미만 예비후보는 단 1명에 불과하다.	경기도 20·30세대 유권자는 전체 인구의 30% 규모를 차지하지만, 20·30대 예비후보자는 더불어민주당 1명, 자유한국당도 단 3명에 불과하며, 그마저도 청년 정치인들이 당내 경선을 거쳐 국회 입성하는 것은 현실적으로 어려움이 크다. 
광주세계수영선수권대회 성공개최를 기념하는 여자프로배구 광주 초청경기가 오는 9월 6일부터 8일까지 3일간 광주빛고을체육관에서 열리며, 각 구단들은 경기력 점검과 배구 저변확대, 프로배구단의 사회환원 차원에서 광주 초청경기를 갖기로 했다.	오는 9월 6일부터 8일까지 광주빛고을체육관에는 KGC인삼공사와 한국도로공사, 현대건설, IBK기업은행 등 여자 프로배구 4개 구단이 참여하여 광주.전남지역 배구붐 조성과 광주세계수영선수권대회 성공개최를 기념하는 여자 프로배구대회가 열린다. 
아디다스가 6월 8일 세계 해양의 날을 맞아 해양환경보호단체 팔리포더오션과 함께 '런포더오션'을 양재시민의 숲에서 개최하고 참가자를 모집하며, 아디다스와 팔리포더오션 단체가 협업을 통해 진행하는 글로벌 프로젝트로 서울을 포함한 로스앤젤레스, 뉴욕, 파리, 베를린, 런던, 바르셀로나, 밀라노, 상하이 등 전 세계 주요 도시에서 해양을 살리기 위한 러닝 이벤트가 열릴 예정이다.	스포츠 브랜드 아디다스는 해양환경보호단체 팔리포더오션과, 해양을 살리기 위해 전 세계 주요 도시에서 진행한 러닝 이벤트 '런포더오션'을 이번에는 양재시민의 숲에서 개최하고 5월 31일부터 6월 5일까지 참가자 1000여 명을 모집한다. 
경기문화재단 문화나눔센터는 가을맞이 문화·여행·체육 분야 활동 장려를 위해 도내 문화누리카드 이용자를 대상으로 '문화누리카드 갑·분·혜(갑자기 분위기 혜택) 이벤트'를 실시한다고 밝혔다.	경기문화재단 문화 나눔센터는 가을맞이 문화·여행·체육 분야 활동을 장려하고자  ‘문화누리카드 갑·분·혜(갑자기 분위기 혜택) 이벤트’를 진행하며,  경기지역 문화누리카드 소지자가 9월 한 달간 문화누리카드를 3만 원 이상 사용 후 그 영수증을 인증하면 추첨을 통해 소정의 상품을 증정할 예정이라고 밝혔다.
음성군 맹동면은 사랑의 모내기 행사를 맹동면 쌍정리 244-3 일원에서 주민자치위원 20여 명이 참석한 가운데 성료 했으며 행사를 주관하는 김태선 주민자치위원장은 사랑의 쌀 나눔이 경로당 어르신은 물론 지역의 저소득 계층 등 한 끼가 부족한 이웃들에게 조금이나마 생활의 도움이 되었으면 좋겠다고 말했다.	음성군 맹동면에서 지난 10일 사랑의 모내기 행사를 통해 경로당 어르신 및 지역의 저소득 계층 등 한 끼가 부족한 이웃들에게 쌀 나눔을 지원했으며, 이는 맹동면에서 겨울마다 진행해온 사랑의 고구마 나눔 행사에 대한 확장 사업으로 음성군 내 나눔 사업의 모범이 되고 있다.
부산 북구는 지난 17일 (재)부산인재평생교육진흥원, 부산대학교 중국연구소와 함께 지역 인문자산기반 평생학습문화 진흥을 위한 업무협약(MOU)을 체결하여 부산 북구의 인문자산을 활용한 평생학습문화 진흥을 위한 공동 브랜드 사업을 발굴하고 다양한 프로그램을 개발 운영하는데 상호 협력할 예정이다.	17일에 부산 북구는 공동 브랜드 사업 발굴과 다양한 프로그램을 개발 운영하기 위해 (재)부산인재평생교육진흥원, 부산대학교 중국연구소와 함께 지역 인문자산기반 평생학습문화 진흥을 위한 업무협약을 체결했으며, 이를 바탕으로 인문학 강좌와 인문 체험 ,축제를 통해 구민들을 지원하게 된다.
양주시의 적극적인 규제 개선 노력이 당초 자동차관리사업 공동대표 등록 불가 규제의 완화를 이끌어 냈으며 이는 자금난 등 어려움을 겪고 있는 자동차관리사업 사업자들에게 다소나마 도움이 될 것이다.	양주시는 자동차 관리 사업자의 공동명의 등록을 이끌어 냄으로 규제 완화를 이루었다.
광주광역시는 정보화 취약계층 정보이용접근 기반조성 등 정보격차 해소를 위해 1억2천300만 원을 투입해 ‘사랑의 그린PC 보급사업’을 추진한다.	광주광역시가 정보격차 해소를 위하여 1억2천300만 원을 투입해 기초생활수급자, 비영리단체 정보교육기관을 선정하여 7월부터 12월까지 600대를 보급하는 ‘사랑의 그린PC 보급사업’을 추진한다고 밝혔다.
괴산군은 18일 괴산읍 명덕초등학교에서 지역에 거주하는 다 문화가족과 괴산 군민이 함께하는 '2019년 세계인의 날 기념 어울림 한마당 체육대회'를 개최하여 레크리에이션, 체육대회 등 다양한 프로그램을 진행했으며 참가자 모두가 함께 즐길 수 있는 체험부스 운영을 통해 화합의 장이 펼쳐졌다.	괴산군은 지난 18일 지역에 거주하는 다문화가족, 외국인 근로자, 새터민가족, 괴산 군민 등 400여 명이 참석한 가운데 '2019년 세계인의 날 기념 어울림 한마당 체육대회'를 개최했으며 레크리에이션, 체육대회 등 다양한 프로그램과 체험부스를 운영해 참가자 모두가 함께 즐기며 화합하는 장을 마련하였다.
오비맥주를 보유하고 있는 브리토 AB인베브가 외국계 증권사들을 통해 롯데와 신세계 등 국내 유통 대기업과 국내외 대형 사모펀드(PEE)운용사에 오비맥주 인수 의사를 타진하고 있다고 보도된 가운데 대주주인 AB인베브가 자산 추가 매각 가능성을 일축했다.	국내 맥주 시장 1위 업체인 오비맥주 매각설이 흘러나오는 가운데, 29일 주류업계에 따르면 카를로스 브리토 AB인베브 회장은 최근 파이낸셜타임스(FT)와의 인터뷰에 따르면 매각 가능성을 일축했다.
삼성 라이온즈가 지난시즌 불펜의 핵심으로 활약했던 심창민의 군 입대와 최충연의 선발보직 변경 등으로 인해 새로운 필승조로 부상하고 있다.	삼성 라이온즈가 새롭게 꾸린 ‘젊은 불펜진’ 최지광(21)-이승현(28)-원태인(19) 조합이 시즌이 지날수록 안정감을 더해가며 필승조로 부상하고 있다.
서선진(59·세림조경건설(주) 회장·사진)대한격투스포츠연맹 회장은 젊은이들에게 꿈과 희망을 주기 위해 고교격투대항전을 시작했으며 앞으로 아시아 단체들과 함께 한국 격투기문화를 새롭게 변화시킬 것이라고 말했다. 	한국 격투기 활성화를 위해 대한격투스포츠연맹을 창설한 서선진 회장은 젊은이들에게 꿈과 희망을 주기 위해 고교격투기대항전을 시작했고 학생들이 올바른 길로 가 자신이 원하는 삶을 살아가는데 도움을 주고자 고교격투대항전을 개최하고 있다고 했다.
한세대학교는 2020학년도 수시모집을 오는 6일부터 10일까지 인터넷으로 접수를 받는다.	한세대학교의 2020학년도 수시모집은 전체 모집인원의 59.7%인 365명을 뽑으며 일반전형은 모든 학과에서 2단계로 진행되고 구체적으로 1단계는 학생부 100%로 모집인원의 7배수를 선발, 2단계에서 학생부 60%, 면접고사 40%를 반영해 최종합격자 196명을 선발한다.
김규학 시의원문화복지위원장은 최근 국가기념일로 승격된 2? 28민주운동의 역사적 보존과 정신계승을 위해 기존 단순 기념식 개최 조례로만 돼 있던 ‘대구시 2? 28민주운동기념사업 조례’를 국가기념일 위상에 맞도록 전부 개정조례안을 발의했다.	시의원문화복지위 이영애 의원의 ' 대구시 출산장려 및 양육지원에 관한 일부개정조례안'과 황순자 시의원건설교통위 소속 의원의 '대구시 아이돌봄 지원 조례안' 등 대구시의원들이 눈길을 끄는 조례안을 연달아 발의하고 있다.
선거법 개정안과 고위공직자범죄수사처(공수처)법 통과라는 결론을 얻으며 패스트트랙 정국이 일단락된 가운데 정치권에서는 각 당의 이해득실에 관심이 쏠리고 있으며 특히 더불어민주당은 지난 23일 시작한 철야 국회 농성에 거의 전원이 참석할 만큼 결속력이 강해졌다고 평가된다.	여야 5당 간의 물리적 충돌을 보이기도 했던 패스트트랙 정국이 5일 만에 선거법 개정안과 공수처법 통과라는 결론을 얻으며 일단락되었고, 각 당의 이해득실에 관심이 쏠리고 있다.  
유니세프 아동친화도시 조성을 목표로 성남시가 지난 21일 수정구 위례광장로 36 위례역푸르지오아파트 4단지 내에 다함께돌봄센터 2호점을 열고 아동과 학부모 및 아동 관련 기관 종사자 24명을 수용할 수 있다.	21일 성남시는 수정구 위례광장로 36 위례역푸르지오아파트 4단지 안에 방과 후 아이돌봄서비스 은수미 Care’ 다함께돌봄센터가 문을 열었다고 밝혔다.
2019 광주세계수영선수권대회 다이빙 여자 1m 스프링보드 종목에서 김수지 선수가 동메달을 획득하여 한국선수가 세계대회 다이빙 종목에서 메달을 딴 것은 개인적으로는 인간승리이고 국가적으로는 희망을 안겨준 메달이라는 것을 증명했다.	2019 광주세계수영선수권대회에서 김수지 선수는 다이빙 여자 1ｍ 스프링보드 종목에서 동메달을 획득하고 개최국 자격으로 참가한 한국 여자수구 팀은 세계 최강팀을 상대로 열심히 싸웠다.
오디엔터테인먼트 오디엔터테인먼트 프로젝트 '팝시컬'(POPSICAL) 핑크레이디의 멤버 서윤과 이후, 예주, 우림, 현지가 다양한 이력과 매력으로 데뷔 전부터 화제를 모으고 있다.	오디엔터테인먼트 '팝시컬' 그룹 핑크레이디 멤버들의 남다른 노래, 연기, 춤 이력이 데뷔 전부터 화제를 모으고 있다.
김하늘은 지난 2016년 3월 1살 연하 사업가 최진혁 씨와 결혼식을 올려 지난 해 5월 딸을 출산한 바 있으며 올해 1월에는 자신이 세레명인 세실리아로 글 하나를 기고해 누리꾼들의 시선을 사로잡았다.	2016년 3월 1살 연하의 사업가 최진혁 씨와 결혼식을 올린 김하늘이 결혼 후 복귀작인 멜로 드라마 《공항 가는 길》에 이어 지난해 5월 딸을 출산한 뒤  jtbc 월화드라마 ‘바람이 분다’로 컴백한다.
전남도는 양파 생산량이 전국 평년보다 15만1천t 과잉될 것으로 전망됨에 따라 6월 초까지 중만생종 1만t, 163ha를 신속 시장 격리할 계획이다.	전남도는 28일  2019년산 양파 재배 생산 단수가 크게 늘어난 반면 가격은 장기간 하락 기조를 유지하고 있어 경영 안정에 어려움을 겪는 재배농가의 부담을 덜어주기 위해 자체적으로 중만생종 1만t, 163㏊를 신속 시장 격리할 계획이라고 밝혔다.
지난해 경기 부진과 부동산 규제 정책이 맞물려 부동산 개발ㆍ공급업이 관련 통계가 집계되기 시작한 2000년 이후 가장 부진했던 것으로 나타났으며, 경기가 어려울 것이라는 전망에 무게가 실리면서 관련 일자리 지표도 힘을 받지 못하는 모양새다.	작년 부동산 개발·공급업이 3년째 감소하며 19년새 가장 부진한 것으로 나타났으며 이는 문재인 정부 출범 이후 잇따른 고강도 규제 정책이 겹친 영향이라는 분석이다.
광주 북구가 2019년 1월 1일 기준 개별공시지가를 결정·공시하고 오는 7월 1일까지 이의신청 접수를 받는 가운데, 이의신청을 원하는 이는 동행정복지센터나 북구청 토지정보과 지가조사팀으로 제출하면 된다.	"광주시 북구 지역의 공시가격이 일부 지역 토지개발사업 등에 따라 전년 대비 7.38% 증가한 가운데, 가장 비싼 땅은 용봉동 전남대 후문 인근인 것으로 나타났다.

